{
  "$schema": "https://raw.githubusercontent.com/B-Commissions/Gantry/main/gantry.schema.json",
  "name": "demo",
  "title": "Demo",
  "version": "0.1.0",
  "port": 8330,
  "mode": "multi",
  "style": "tea",
  "tray": true,
  "buttons": {
    "minimize": true,
    "maximize": true,
    "close": true
  },
  "mobile": {
    "id": "ec.morrison.demo"
  }
}
