{
  "$schema": "https://raw.githubusercontent.com/BlueBeard63/Gantry/main/gantry.schema.json",
  "name": "hello",
  "title": "Hello",
  "version": "0.1.0",
  "port": 8330,
  "mode": "single",
  "style": "plain",
  "tray": false,
  "buttons": {
    "minimize": true,
    "maximize": false,
    "close": true
  }
}
